{
  "mainText": "Hacemos de cada detalle un acto de cuidado. Somos amantes de nuestro oficio y de la pasión que nace del equipo. La cultura no se impone: se sostiene. Cada personaje opera bajo un mismo estándar, el de las cosas bien hechas.",
  "secondaryText": "Crecemos desde dentro. El oficio no se aprende solo. Se construye con el equipo todos los días.",
  "gallery": [],
  "bottomText": "REINVENTEMOS EL MUNDO A PLATOS"
}
